{
  "schema_version": "1.0",
  "project": "Circle Arc, proposed ARC token (whitepaper, May 2026)",
  "chain": "Arc, described in the whitepaper abstract as a public Layer-1 blockchain. The ARC token is described as not launched.",
  "prepared_date": "2026-10-14",
  "scope_note": "Covers the supply, inflation, burn, fee-routing, allocation and vesting statements on printed pages 1, 7, 8, 9, 10 and 12 of the whitepaper PDF (12 pages), and three FAQ answers on the official page (launch of a native token, whether the ARC token has launched, and equity in Circle). The whitepaper describes a proposed design, not a live token. Pages 2-6 and 11 were not reviewed; Section VI (Governance) was seen only in part (the end of page 10 and Table 4 on page 12).",
  "source_access": "S1: printed pages 1, 7, 8, 9, 10 and 12 were checked against screenshots of the PDF supplied by the contractor on 2026-10-12; wording, figures and locations were corrected where they differed. Screenshots of the PDF viewer show the viewer's page box equal to the printed page number for printed pages 7, 8, 9 and 12; the viewer number for printed page 10 was not captured. The drafting assistant could not open the document itself. Line numbers from earlier notes are not visible in the PDF and are not used. S2: the FAQ was checked against three screenshots of www.arc.io/arc-token-whitepaper supplied by the contractor on 2026-10-12, which show the FAQ heading, three questions with answers, and no date; no further items were visible below the third. Quotes marked pending_paste must be typed from the source by the contractor. S3 and S4 were opened and read by the drafting assistant on 2026-10-14. On 2026-10-14 the contractor supplied further text from the arc.io page footer and a second set of page numbers. The footer text was supplied as text and is to be confirmed with a screenshot. A second set of page numbers supplied the same day (printed numbers one lower and viewer numbers one higher for several pages) was contradicted by the screenshots and is not used.",
  "sources": [
    {
      "id": "S1",
      "title": "ARC: The Native Asset of the Economic OS (Circle whitepaper, PDF, 12 pages)",
      "url": "https://6778953.fs1.hubspotusercontent-na1.net/hubfs/6778953/PDFs/arc_whitepaper.pdf",
      "type": "primary",
      "date_accessed": "2026-10-14",
      "document_date": "May 2026 (printed on page 1)"
    },
    {
      "id": "S2",
      "title": "Official ARC whitepaper page with FAQ (www.arc.io/arc-token-whitepaper)",
      "url": "https://www.arc.io/arc-token-whitepaper",
      "type": "primary",
      "date_accessed": "2026-10-14",
      "document_date": "Not stated"
    },
    {
      "id": "S3",
      "title": "Decrypt, Circle raises $222M in Arc token presale at $3B valuation",
      "url": "https://decrypt.co/367386/circle-raises-222m-in-arc-token-presale-at-3b-valuation",
      "type": "secondary",
      "date_accessed": "2026-10-14",
      "document_date": "May 11, 2026"
    },
    {
      "id": "S4",
      "title": "Circle Reports First Quarter 2026 Results (Circle press release)",
      "url": "https://www.circle.com/pressroom/circle-reports-first-quarter-2026-results",
      "type": "primary",
      "date_accessed": "2026-10-14",
      "document_date": "May 11, 2026"
    }
  ],
  "claims": [
    {
      "id": "ARC-01",
      "category": "burn",
      "promise": "Fees on Arc are converted to ARC and split between compensation to validators and stakers and a burn that offsets new issuance. The initial configuration is described as directing a meaningful portion to burn from the outset, with no figure stated. The paper's long-term objective is inflation neutrality (burn fully offsets new issuance), which it says is not guaranteed by a fixed timeline. The split ratio is described as configurable and adjustable by governance.",
      "quote": "The ratio between distribution and burn is configurable and may change over time as the network’s economic profile evolves.",
      "quote_status": "verbatim",
      "source": {
        "source_id": "S1",
        "url": "https://6778953.fs1.hubspotusercontent-na1.net/hubfs/6778953/PDFs/arc_whitepaper.pdf",
        "location": "Printed page 7, Section V 'Economic Architecture', 'Supply and inflation' (inflation neutrality); printed page 8, 'Fee mechanics and conversion' and Figure 3",
        "date_accessed": "2026-10-14"
      },
      "numbers": [
        "Burn share of fees: configurable and may change by governance; no committed figure stated (initial configuration described only as 'a meaningful portion')",
        "Figure 3 (page 8) illustrates 50% for burn and is labelled illustrative, not projections or commitments"
      ],
      "dates": [
        "No fixed timeline for inflation neutrality (as stated)"
      ],
      "checkable_onchain": "no",
      "how_to_check": "Nothing to check on-chain: the FAQ says the ARC token has not launched. If a token contract is published later, check burn transfers there."
    },
    {
      "id": "ARC-02",
      "category": "supply",
      "promise": "The initial supply of ARC would be 10 billion tokens.",
      "quote": "ARC will have an initial supply of 10 billion tokens.",
      "quote_status": "verbatim",
      "source": {
        "source_id": "S1",
        "url": "https://6778953.fs1.hubspotusercontent-na1.net/hubfs/6778953/PDFs/arc_whitepaper.pdf",
        "location": "Printed page 7, Section V 'Economic Architecture', 'Supply and inflation'; repeated on printed page 10, 'Token allocation'",
        "date_accessed": "2026-10-14"
      },
      "numbers": [
        "10,000,000,000 ARC initial supply"
      ],
      "dates": [
        "Not stated"
      ],
      "checkable_onchain": "no",
      "how_to_check": "No ARC token contract is described as existing (see ARC-07). Total supply could be read from the token contract if one is published."
    },
    {
      "id": "ARC-03",
      "category": "supply",
      "promise": "ARC is to have a decaying inflation model: new ARC is issued at a modest annual rate expected to begin at approximately 2% to 3% and distributed to validators and stakers. The inflation rate is described as declining according to a predefined schedule that governance can change.",
      "quote": "In the early phases, new ARC is issued at a modest annual rate, expected to begin at approximately 2–3%",
      "quote_status": "verbatim",
      "source": {
        "source_id": "S1",
        "url": "https://6778953.fs1.hubspotusercontent-na1.net/hubfs/6778953/PDFs/arc_whitepaper.pdf",
        "location": "Printed page 7, Section V 'Economic Architecture', 'Supply and inflation'",
        "date_accessed": "2026-10-14"
      },
      "numbers": [
        "Expected to begin at approximately 2% to 3% annually",
        "Decline schedule: described as predefined and subject to change by governance, but not given in the text reviewed (Figure 3 is labelled illustrative)"
      ],
      "dates": [
        "Not stated"
      ],
      "checkable_onchain": "no",
      "how_to_check": "Not checkable until a token and issuance mechanism exist on-chain."
    },
    {
      "id": "ARC-04",
      "category": "allocation",
      "promise": "The initial supply of 10 billion tokens is allocated across three categories: Ecosystem 60%, Circle 25%, Long-Term Reserve 15%. The Ecosystem share is described as including token sales, developer grants, growth programmes and broader participation. Figure 5 calls the allocation indicative, and exact unlock and release schedules are to be announced in the coming months.",
      "quote": "ARC’s initial supply of 10 billion tokens is allocated across three categories, each corresponding to a structural role in the network’s development and long-term operation.",
      "quote_status": "verbatim",
      "source": {
        "source_id": "S1",
        "url": "https://6778953.fs1.hubspotusercontent-na1.net/hubfs/6778953/PDFs/arc_whitepaper.pdf",
        "location": "Printed page 10, 'Token allocation' (text and Figure 5 donut chart and legend)",
        "date_accessed": "2026-10-14"
      },
      "numbers": [
        "Ecosystem 60%",
        "Circle 25%",
        "Long-Term Reserve 15%",
        "Total initial supply 10 billion tokens"
      ],
      "dates": [
        "Not stated"
      ],
      "checkable_onchain": "no",
      "how_to_check": "No allocation wallets or token contract are described as existing; check the token contract and allocation addresses if published."
    },
    {
      "id": "ARC-05",
      "category": "team_vesting",
      "promise": "The 25% Circle allocation is described as reflecting Circle's role as builder of the protocol and supporting Circle's ongoing operations on the network. The text says it lets Circle keep meaningful economic alignment with the network while participating directly in staking and governance and administering ecosystem programmes.",
      "quote": "This allocation reflects Circle’s role as the builder of the protocol and supports Circle’s ongoing operations on the network.",
      "quote_status": "verbatim",
      "source": {
        "source_id": "S1",
        "url": "https://6778953.fs1.hubspotusercontent-na1.net/hubfs/6778953/PDFs/arc_whitepaper.pdf",
        "location": "Printed page 10, 'Token allocation', bullet '25% - Circle', and Figure 5 legend",
        "date_accessed": "2026-10-14"
      },
      "numbers": [
        "25% of 10,000,000,000 initial supply"
      ],
      "dates": [
        "Not stated"
      ],
      "checkable_onchain": "no",
      "how_to_check": "Not checkable until a token and allocation addresses exist.",